{
    "projectName": "Hello World CLI",
    "description": "A simple CLI that greets users by name",
    "version": "1.0.0",
    "features": [
        {
            "id": "F001",
            "priority": 1,
            "title": "Basic Hello Command",
            "description": "Create a CLI that accepts a name argument and prints 'Hello, {name}!'",
            "acceptanceCriteria": [
                "CLI accepts a --name or -n argument",
                "Prints 'Hello, {name}!' to stdout",
                "Returns exit code 0 on success"
            ],
            "passes": false,
            "testFiles": [],
            "implementedFiles": [],
            "notes": "Entry point for the CLI application"
        },
        {
            "id": "F002",
            "priority": 2,
            "title": "Default Name Fallback",
            "description": "If no name is provided, default to 'World'",
            "acceptanceCriteria": [
                "When called without --name, prints 'Hello, World!'",
                "Help text documents the default behavior"
            ],
            "passes": false,
            "testFiles": [],
            "implementedFiles": [],
            "notes": "Depends on F001"
        },
        {
            "id": "F003",
            "priority": 3,
            "title": "Greeting Customization",
            "description": "Allow customizing the greeting word",
            "acceptanceCriteria": [
                "Accepts --greeting or -g argument",
                "Prints '{greeting}, {name}!' when provided",
                "Defaults to 'Hello' when not provided"
            ],
            "passes": false,
            "testFiles": [],
            "implementedFiles": [],
            "notes": "Nice-to-have feature"
        }
    ],
    "ciConfig": {
        "testCommand": "npm test",
        "buildCommand": "npm run build"
    }
}